{
  "schemaVersion": 1,
  "operationType": "REVERSE",
  "operationId": "evt-incentive-reverse-0001",
  "reservationId": "11111111-1111-4111-8111-111111111111",
  "redemptionId": "22222222-2222-4222-8222-222222222222",
  "reversalOfRedemptionId": "22222222-2222-4222-8222-222222222222",
  "campaignId": "33333333-3333-4333-8333-333333333333",
  "campaignVersion": 4,
  "couponId": "44444444-4444-4444-8444-444444444444",
  "effectId": "33333333-3333-4333-8333-333333333333:4:ORDER_FIXED_OFF:ORDER:order",
  "benefitType": "DISCOUNT",
  "actionType": "ORDER_FIXED_OFF",
  "targetType": "ORDER",
  "targetId": null,
  "amount": 10.00,
  "currency": "USD",
  "unit": "MONEY",
  "quantity": 10.00,
  "direction": "COMPENSATE",
  "occurredAt": "2026-06-14T03:15:00Z",
  "correlationId": "corr-incentive-reverse-001",
  "sourceClientId": "support-console"
}
